{
  "schema": "graph/1",
  "ontology": "ontology.yaml",
  "module": "Claude.Agent.Orchestrator",
  "version": "0.1.0",
  "layer": "2026-10-11T10:08:56Z",
  "root": "claude-agent-dev",
  "nodes": [
    {
      "id": "claude-agent-dev",
      "kind": "environment.instance",
      "name": "claude-agent-dev (compose on MSI)",
      "properties": {
        "kind": "compose",
        "principal": "ui:principal:dev-bootstrap",
        "mitmAddress": "http://mitm:8080",
        "imageDigest": "sha256:80f63c0647d0635f4c59b9e118506aca52319a1041537141ec07f9f821433c31",
        "host": "MSI",
        "updated": "2026-10-11T10:08:56Z",
        "portalBase": "http://127.0.0.1:8200",
        "started": "2026-10-11T10:08:47Z",
        "ledgerCopyOut": "artifacts/ledger/ledger.jsonl",
        "state": "running",
        "composeProject": "claude-agent-dev",
        "env": "dev",
        "group": "stack",
        "tags": [
          "agent",
          "compose"
        ]
      },
      "source": [
        {
          "tool": "Claude.Agent.Orchestrator",
          "path": "docker inspect (compose project claude-agent-dev)"
        }
      ]
    },
    {
      "id": "claude-agent-dev/agent",
      "kind": "environment.instance",
      "name": "agent (claude-agent:dev)",
      "properties": {
        "containerId": "f0cf32129db6a9d5c8fe4e58caba7422628603f137291f4b5b03ae90ddfb73ae",
        "networks": [
          "inside"
        ],
        "kind": "container",
        "service": "agent",
        "started": "2026-10-11T10:08:47.818801859Z",
        "updated": "2026-10-11T10:08:56Z",
        "imageId": "sha256:80f63c0647d0635f4c59b9e118506aca52319a1041537141ec07f9f821433c31",
        "image": "claude-agent:dev",
        "state": "running",
        "composeProject": "claude-agent-dev",
        "env": "dev",
        "group": "stack",
        "tags": [
          "agent"
        ]
      },
      "source": [
        {
          "tool": "Claude.Agent.Orchestrator",
          "path": "docker inspect (compose project claude-agent-dev)"
        }
      ]
    },
    {
      "id": "claude-agent-dev/ledger",
      "kind": "environment.instance",
      "name": "ledger (claude-agent-ledger:dev)",
      "properties": {
        "containerId": "e9282afe7a7bd33e272b9572270c4a916bc27e41e0b4ebd46cbcf91caab12da3",
        "networks": [
          "none"
        ],
        "kind": "container",
        "service": "ledger",
        "started": "2026-10-11T10:08:41.442824742Z",
        "updated": "2026-10-11T10:08:56Z",
        "imageId": "sha256:82d1b05d4c1e7bd07076216e6ad0b23f58a6bba6d817ec97fa253071579cd891",
        "image": "claude-agent-ledger:dev",
        "state": "running",
        "composeProject": "claude-agent-dev"
      },
      "source": [
        {
          "tool": "Claude.Agent.Orchestrator",
          "path": "docker inspect (compose project claude-agent-dev)"
        }
      ]
    },
    {
      "id": "claude-agent-dev/mitm",
      "kind": "environment.instance",
      "name": "mitm (mitmproxy/mitmproxy:12.2.3)",
      "properties": {
        "containerId": "ec62cbdd84c1d054edde66961603c01a2085a1c97dad6d1513abcc4febbc8597",
        "networks": [
          "inside",
          "outside"
        ],
        "kind": "container",
        "service": "mitm",
        "started": "2026-10-11T10:08:41.50514843Z",
        "updated": "2026-10-11T10:08:56Z",
        "imageId": "sha256:90d20030c6789da3a4164407a6934ecd30f1b88e7941161e6fe9c703c91d589d",
        "image": "mitmproxy/mitmproxy:12.2.3",
        "state": "running",
        "composeProject": "claude-agent-dev",
        "env": "dev",
        "group": "egress",
        "tags": [
          "egress"
        ]
      },
      "source": [
        {
          "tool": "Claude.Agent.Orchestrator",
          "path": "docker inspect (compose project claude-agent-dev)"
        }
      ]
    }
  ],
  "edges": [
    {
      "id": "claude-agent-dev/agent|claude-agent-dev|member-of",
      "kind": "member-of",
      "from": "claude-agent-dev/agent",
      "to": "claude-agent-dev"
    },
    {
      "id": "claude-agent-dev/ledger|claude-agent-dev|member-of",
      "kind": "member-of",
      "from": "claude-agent-dev/ledger",
      "to": "claude-agent-dev"
    },
    {
      "id": "claude-agent-dev/mitm|claude-agent-dev|member-of",
      "kind": "member-of",
      "from": "claude-agent-dev/mitm",
      "to": "claude-agent-dev"
    },
    {
      "id": "claude-agent-dev|ui:principal:dev-bootstrap|runs-as",
      "kind": "runs-as",
      "from": "claude-agent-dev",
      "to": "ui:principal:dev-bootstrap"
    },
    {
      "id": "claude-agent-dev|agent:run/2026-10-09T02:50:43.7976027Z|hosts",
      "kind": "hosts",
      "from": "claude-agent-dev",
      "to": "agent:run/2026-10-09T02:50:43.7976027Z"
    }
  ],
  "findings": [],
  "counts": {
    "nodes": 4,
    "edges": 5,
    "byKind": {
      "environment.instance": 4
    }
  }
}
